{
  "$schema": "./contracts/provenance.schema.json",
  "name": "Test4Test Design System",
  "version": "1.0.0",
  "source": "C:/Projects/AI Design System/Test4Test Design System Specification.md",
  "sourceSha256": "ed746438cd1993a5c58a95fa2ea452f455c6bdeafc24b92598699424699e3171",
  "repositoryPath": "design-system/specification.md",
  "owner": "Test4Test",
  "implementationAgent": "Codex",
  "generationMethod": "DTCG source tokens compiled by scripts/generate-design-system.mjs",
  "adoptedAt": "2026-07-23T00:00:00-04:00"
}
